{
  "model": {
    "vocab_size": 258,
    "max_seq_len": 64,
    "n_layers": 2,
    "n_heads": 2,
    "d_model": 128,
    "d_ff": 512,
    "dropout": 0.1
  },
  "tokenizer": {
    "type": "byte",
    "bos_token_id": 256,
    "eos_token_id": 257
  },
  "data": {
    "dataset_path": "data/tiny.txt",
    "num_workers": 0
  },
  "training": {
    "batch_size": 16,
    "micro_batch_size": 8,
    "max_steps": 50,
    "eval_interval": 10,
    "seed": 42,
    "device": "cpu"
  },
  "optimizer": {
    "type": "adamw",
    "lr": 0.0003,
    "betas": [
      0.9,
      0.95
    ],
    "weight_decay": 0.1
  },
  "scheduler": {
    "type": "cosine",
    "warmup_steps": 0
  },
  "generate": {
    "max_new_tokens": 64,
    "temperature": 0.9,
    "top_k": 50,
    "top_p": 0.9,
    "repetition_penalty": 1.1
  }
}